{"nodes":
 [{"outputs": [{"name": "out", "kind": "stream"}],
   "kind":
   {"type": "leaf",
    "retry": {"retrySeconds": 1, "maxAttempts": 2, "leaseSeconds": 3},
    "concurrency": 2},
   "inputs": [{"name": "in", "kind": "plain"}],
   "id": "emit"},
  {"outputs": [{"name": "out", "kind": "stream"}],
   "kind": {"type": "filter"},
   "inputs": [{"name": "in", "kind": "stream"}],
   "id": "filter"},
  {"outputs": [{"name": "out", "kind": "plain"}],
   "kind": {"type": "collect"},
   "inputs": [{"name": "in", "kind": "stream"}],
   "id": "collect"}],
 "exits": [{"port": "out", "node": "collect"}],
 "entries": [{"port": "in", "node": "emit"}],
 "edges":
 [{"src": {"port": "out", "node": "emit"},
   "dst": {"port": "in", "node": "filter"}},
  {"src": {"port": "out", "node": "filter"},
   "dst": {"port": "in", "node": "collect"}}]}
