{"nodes":
 [{"outputs": [{"name": "out", "kind": "plain"}],
   "kind":
   {"type": "leaf",
    "retry": {"retrySeconds": 1, "maxAttempts": 2, "leaseSeconds": 3},
    "concurrency": 2},
   "inputs": [{"name": "in", "kind": "plain"}],
   "id": "work"}],
 "exits": [{"port": "out", "node": "work"}],
 "entries": [{"port": "in", "node": "work"}],
 "edges": []}
