{"nodes":
 [{"outputs": [{"name": "out", "kind": "stream"}],
   "kind":
   {"type": "leaf",
    "retry": {"retrySeconds": 1, "maxAttempts": 2, "leaseSeconds": 3},
    "concurrency": 2},
   "inputs": [{"name": "in", "kind": "plain"}],
   "id": "a"},
  {"outputs": [{"name": "out", "kind": "stream"}],
   "kind":
   {"type": "leaf",
    "retry": {"retrySeconds": 1, "maxAttempts": 2, "leaseSeconds": 3},
    "concurrency": 2},
   "inputs": [{"name": "in", "kind": "plain"}],
   "id": "b"},
  {"outputs": [{"name": "out", "kind": "stream"}],
   "kind": {"type": "merge"},
   "inputs": [{"name": "a", "kind": "stream"}, {"name": "b", "kind": "stream"}],
   "id": "merge"},
  {"outputs": [{"name": "out", "kind": "plain"}],
   "kind": {"type": "collect"},
   "inputs": [{"name": "in", "kind": "stream"}],
   "id": "collect"}],
 "exits": [{"port": "out", "node": "collect"}],
 "entries": [{"port": "in", "node": "a"}, {"port": "in", "node": "b"}],
 "edges":
 [{"src": {"port": "out", "node": "a"}, "dst": {"port": "a", "node": "merge"}},
  {"src": {"port": "out", "node": "b"}, "dst": {"port": "b", "node": "merge"}},
  {"src": {"port": "out", "node": "merge"},
   "dst": {"port": "in", "node": "collect"}}]}
