{"nodes":
 [{"outputs":
   [{"name": "left", "kind": "plain"}, {"name": "right", "kind": "plain"}],
   "kind": {"type": "branch", "arms": ["left", "right"]},
   "inputs": [{"name": "in", "kind": "plain"}],
   "id": "choose"},
  {"outputs": [{"name": "out", "kind": "plain"}],
   "kind":
   {"type": "leaf",
    "retry": {"retrySeconds": 1, "maxAttempts": 2, "leaseSeconds": 3},
    "concurrency": 2},
   "inputs": [{"name": "in", "kind": "plain"}],
   "id": "left"},
  {"outputs": [{"name": "out", "kind": "plain"}],
   "kind":
   {"type": "leaf",
    "retry": {"retrySeconds": 1, "maxAttempts": 2, "leaseSeconds": 3},
    "concurrency": 2},
   "inputs": [{"name": "in", "kind": "plain"}],
   "id": "right"},
  {"outputs": [{"name": "out", "kind": "plain"}],
   "kind": {"type": "coalesce"},
   "inputs":
   [{"name": "left", "kind": "plain"}, {"name": "right", "kind": "plain"}],
   "id": "join"}],
 "exits": [{"port": "out", "node": "join"}],
 "entries": [{"port": "in", "node": "choose"}],
 "edges":
 [{"src": {"port": "left", "node": "choose"},
   "dst": {"port": "in", "node": "left"}},
  {"src": {"port": "right", "node": "choose"},
   "dst": {"port": "in", "node": "right"}},
  {"src": {"port": "out", "node": "left"},
   "dst": {"port": "left", "node": "join"}},
  {"src": {"port": "out", "node": "right"},
   "dst": {"port": "right", "node": "join"}}]}
