{"nodes":
 [{"outputs":
   [{"name": "left", "kind": "plain"}, {"name": "right", "kind": "plain"}],
   "kind": {"type": "branch", "arms": ["left", "right"]},
   "inputs": [{"name": "in", "kind": "plain"}],
   "id": "firstChoice"},
  {"outputs": [{"name": "out", "kind": "plain"}],
   "kind": {"type": "coalesce"},
   "inputs":
   [{"name": "left", "kind": "plain"}, {"name": "right", "kind": "plain"}],
   "id": "firstJoin"},
  {"outputs":
   [{"name": "left", "kind": "plain"}, {"name": "right", "kind": "plain"}],
   "kind": {"type": "branch", "arms": ["left", "right"]},
   "inputs": [{"name": "in", "kind": "plain"}],
   "id": "secondChoice"},
  {"outputs": [{"name": "out", "kind": "plain"}],
   "kind": {"type": "coalesce"},
   "inputs":
   [{"name": "left", "kind": "plain"}, {"name": "right", "kind": "plain"}],
   "id": "secondJoin"}],
 "exits": [{"port": "out", "node": "secondJoin"}],
 "entries": [{"port": "in", "node": "firstChoice"}],
 "edges":
 [{"src": {"port": "left", "node": "firstChoice"},
   "dst": {"port": "left", "node": "firstJoin"}},
  {"src": {"port": "right", "node": "firstChoice"},
   "dst": {"port": "right", "node": "firstJoin"}},
  {"src": {"port": "out", "node": "firstJoin"},
   "dst": {"port": "in", "node": "secondChoice"}},
  {"src": {"port": "left", "node": "secondChoice"},
   "dst": {"port": "left", "node": "secondJoin"}},
  {"src": {"port": "right", "node": "secondChoice"},
   "dst": {"port": "right", "node": "secondJoin"}}]}
