{"nodes":
 [{"outputs": [{"name": "out", "kind": "stream"}],
   "kind":
   {"type": "leaf",
    "retry": {"retrySeconds": 1, "maxAttempts": 2, "leaseSeconds": 3},
    "concurrency": 2},
   "inputs": [{"name": "in", "kind": "plain"}],
   "id": "emit"},
  {"outputs": [{"name": "out", "kind": "stream"}],
   "kind":
   {"type": "forEach",
    "body":
    {"nodes":
     [{"outputs": [{"name": "out", "kind": "plain"}],
       "kind":
       {"type": "leaf",
        "retry": {"retrySeconds": 1, "maxAttempts": 2, "leaseSeconds": 3},
        "concurrency": 2},
       "inputs": [{"name": "in", "kind": "plain"}],
       "id": "work"}],
     "exits": [{"port": "out", "node": "work"}],
     "entries": [{"port": "in", "node": "work"}],
     "edges": []}},
   "inputs": [{"name": "in", "kind": "stream"}],
   "id": "each"},
  {"outputs": [{"name": "out", "kind": "plain"}],
   "kind": {"type": "collect"},
   "inputs": [{"name": "in", "kind": "stream"}],
   "id": "collect"}],
 "exits": [{"port": "out", "node": "collect"}],
 "entries": [{"port": "in", "node": "emit"}],
 "edges":
 [{"src": {"port": "out", "node": "emit"},
   "dst": {"port": "in", "node": "each"}},
  {"src": {"port": "out", "node": "each"},
   "dst": {"port": "in", "node": "collect"}}]}
